{
  "actionId": "action-002",
  "environmentId": "env-local-windows-01",
  "providerId": "imageProvider.imagemagick",
  "providerVersion": "7.1.2",
  "startedAt": "2026-10-10T09:00:00.000Z",
  "finishedAt": "2026-10-10T09:00:02.000Z",
  "terminal": "REFUSED",
  "outputRefs": [],
  "sideEffectEvidence": {
    "sideEffectClass": "R2",
    "recoveryClassification": "NOT_STARTED",
    "postStateVerified": false
  }
}
